{
  "schema_version": "1.0",
  "device_id": "550e8400-e29b-41d4-a716-446655440000",
  "state": "happy",
  "overlay": null,
  "battery_level": null,
  "wifi_connected": true,
  "backend_connected": true,
  "firmware_version": "1.0.0",
  "xvf3800_version": "2.1.0",
  "timestamp": "2025-08-20T14:30:00Z"
}
